{
  "$schema": "../../schemas/questions/sprach-a-lyzer_question-catalogue_v0.1.json",
  "catalogue_version": "0.1",
  "status": "APPROVED",
  "locale": "de-DE",
  "version_contract": {
    "canonical_question": "0.1",
    "question_rendering": "0.1",
    "qa_observation": "0.1",
    "question_selection": "0.1",
    "question_session": "0.1",
    "policy_registry": "0.7"
  },
  "questions": [
    {
      "contract_version": "0.1",
      "question_id": "CQ007",
      "construct_intent": "LOCUS_OF_CONTROL",
      "secondary_constructs": ["AGENCY", "CLARITY"],
      "phase": "P1_ENTRY",
      "audience_scope": "BOTH",
      "risk_level": "LOW",
      "canonical_semantics": "Erfragt realistisch beeinflussbare und nicht beeinflussbare Anteile, ohne Handlungsmacht zu unterstellen.",
      "prohibited_semantics": ["Ohnmacht diagnostizieren", "vollständige Kontrolle unterstellen"],
      "expected_dimensions": ["AGENCY", "VOLITION", "CLARITY"],
      "question_score_bias": 0,
      "status": "APPROVED",
      "version": 1
    },
    {
      "contract_version": "0.1",
      "question_id": "CQ008",
      "construct_intent": "RESOURCES",
      "secondary_constructs": ["AGENCY", "OPENNESS"],
      "phase": "P1_ENTRY",
      "audience_scope": "BOTH",
      "risk_level": "LOW",
      "canonical_semantics": "Erfragt bereits beobachtbare hilfreiche Ausnahmen oder Ressourcen ohne erzwungene Positivität.",
      "prohibited_semantics": ["vorhandene Ressourcen unterstellen", "Belastung relativieren"],
      "expected_dimensions": ["AGENCY", "OPENNESS"],
      "question_score_bias": 0,
      "status": "APPROVED",
      "version": 1
    },
    {
      "contract_version": "0.1",
      "question_id": "CQ009",
      "construct_intent": "VALUES",
      "secondary_constructs": ["CLARITY", "VOLITION"],
      "phase": "P1_ENTRY",
      "audience_scope": "BOTH",
      "risk_level": "LOW",
      "canonical_semantics": "Erfragt ausdrücklich benannte Wichtigkeit oder Werte, ohne einen bestimmten Wert vorzugeben.",
      "prohibited_semantics": ["Wertehierarchie unterstellen", "moralische Bewertung erzeugen"],
      "expected_dimensions": ["CLARITY", "VOLITION"],
      "question_score_bias": 0,
      "status": "APPROVED",
      "version": 1
    },
    {
      "contract_version": "0.1",
      "question_id": "CQ013",
      "construct_intent": "BELIEFS",
      "secondary_constructs": ["OPENNESS", "AGENCY"],
      "phase": "P1_ENTRY",
      "audience_scope": "BOTH",
      "risk_level": "MEDIUM",
      "canonical_semantics": "Erfragt wiederkehrende eigene Sprache als beobachtbares Muster und nicht als stabile Persönlichkeitseigenschaft.",
      "prohibited_semantics": ["Glaubenssatz diagnostizieren", "Selbstbeschreibung als Trait festschreiben"],
      "expected_dimensions": ["OPENNESS", "AGENCY", "VOLITION"],
      "question_score_bias": 0,
      "status": "APPROVED",
      "version": 1
    },
    {
      "contract_version": "0.1",
      "question_id": "CQ021",
      "construct_intent": "CLARITY",
      "secondary_constructs": ["SPECIFICITY"],
      "phase": "P2_FOLLOWUP_1_10",
      "audience_scope": "BOTH",
      "risk_level": "LOW",
      "canonical_semantics": "Erfragt die konkrete Bedeutung eines verwendeten Ausdrucks, ohne dessen bisherige Bedeutung abzuwerten.",
      "prohibited_semantics": ["Unklarheit als Defizit bewerten", "eine Definition vorgeben"],
      "expected_dimensions": ["CLARITY"],
      "question_score_bias": 0,
      "status": "APPROVED",
      "version": 1
    },
    {
      "contract_version": "0.1",
      "question_id": "CQ023",
      "construct_intent": "ASSUMPTIONS",
      "secondary_constructs": ["CLARITY", "OPENNESS"],
      "phase": "P2_FOLLOWUP_1_10",
      "audience_scope": "BOTH",
      "risk_level": "MEDIUM",
      "canonical_semantics": "Lädt zur Prüfung einer möglichen Annahme ein, ohne ihr Vorliegen oder ihre Falschheit vorauszusetzen.",
      "prohibited_semantics": ["verdeckte Annahme behaupten", "Gedanken anderer als Tatsache darstellen"],
      "expected_dimensions": ["CLARITY", "OPENNESS"],
      "question_score_bias": 0,
      "status": "APPROVED",
      "version": 1
    },
    {
      "contract_version": "0.1",
      "question_id": "CQ024",
      "construct_intent": "PERSPECTIVE_TAKING",
      "secondary_constructs": ["CONNECTION", "OPENNESS"],
      "phase": "P2_FOLLOWUP_1_10",
      "audience_scope": "BOTH",
      "risk_level": "LOW",
      "canonical_semantics": "Erfragt eine mögliche andere Beschreibung, ohne deren Wahrheit oder Motive zu behaupten.",
      "prohibited_semantics": ["Fremdperspektive als Tatsache ausgeben", "Verantwortung relativieren"],
      "expected_dimensions": ["CONNECTION", "OPENNESS"],
      "question_score_bias": 0,
      "status": "APPROVED",
      "version": 1
    },
    {
      "contract_version": "0.1",
      "question_id": "CQ034",
      "construct_intent": "OPTIONS",
      "secondary_constructs": ["VOLITION", "OPENNESS", "AGENCY"],
      "phase": "P2_FOLLOWUP_1_10",
      "audience_scope": "BOTH",
      "risk_level": "MEDIUM",
      "canonical_semantics": "Erfragt eine bislang ausgeschlossene Option, ohne deren Eignung oder Umsetzbarkeit zu unterstellen.",
      "prohibited_semantics": ["mehr Optionen mit besserer Entscheidung gleichsetzen", "Handlungsdruck erzeugen"],
      "expected_dimensions": ["VOLITION", "OPENNESS", "AGENCY"],
      "question_score_bias": 0,
      "status": "APPROVED",
      "version": 1
    }
  ],
  "renderings": [
    {"contract_version":"0.1","rendering_id":"CQ007:PRIVATE_STANDARD:v1","question_id":"CQ007","rendering_profile":"PRIVATE_STANDARD","locale":"de-DE","language_level":"STANDARD","text":"Was davon liegt heute tatsächlich in deinem Einflussbereich?","rephrase_type":"CANONICAL","leadingness":0.2,"specificity":0.75,"intimacy_level":0.2,"spiritual_explicitness":0,"relational_warmth":0.5,"requires_opt_in":false,"status":"APPROVED","version":1},
    {"contract_version":"0.1","rendering_id":"CQ007:CORPORATE_STANDARD:v1","question_id":"CQ007","rendering_profile":"CORPORATE_STANDARD","locale":"de-DE","language_level":"STANDARD","text":"Was davon liegt heute tatsächlich in Ihrem Einflussbereich?","rephrase_type":"CANONICAL","leadingness":0.2,"specificity":0.75,"intimacy_level":0.1,"spiritual_explicitness":0,"relational_warmth":0.5,"requires_opt_in":false,"status":"APPROVED","version":1},
    {"contract_version":"0.1","rendering_id":"CQ008:PRIVATE_STANDARD:v1","question_id":"CQ008","rendering_profile":"PRIVATE_STANDARD","locale":"de-DE","language_level":"STANDARD","text":"Was funktioniert trotz der Herausforderung bereits ein wenig?","rephrase_type":"CANONICAL","leadingness":0.25,"specificity":0.65,"intimacy_level":0.2,"spiritual_explicitness":0,"relational_warmth":0.5,"requires_opt_in":false,"status":"APPROVED","version":1},
    {"contract_version":"0.1","rendering_id":"CQ008:CORPORATE_STANDARD:v1","question_id":"CQ008","rendering_profile":"CORPORATE_STANDARD","locale":"de-DE","language_level":"STANDARD","text":"Was funktioniert trotz der Herausforderung bereits ein wenig?","rephrase_type":"CANONICAL","leadingness":0.25,"specificity":0.65,"intimacy_level":0.1,"spiritual_explicitness":0,"relational_warmth":0.5,"requires_opt_in":false,"status":"APPROVED","version":1},
    {"contract_version":"0.1","rendering_id":"CQ009:PRIVATE_STANDARD:v1","question_id":"CQ009","rendering_profile":"PRIVATE_STANDARD","locale":"de-DE","language_level":"STANDARD","text":"Was ist dir an dieser Situation besonders wichtig?","rephrase_type":"CANONICAL","leadingness":0.2,"specificity":0.7,"intimacy_level":0.25,"spiritual_explicitness":0,"relational_warmth":0.5,"requires_opt_in":false,"status":"APPROVED","version":1},
    {"contract_version":"0.1","rendering_id":"CQ009:CORPORATE_STANDARD:v1","question_id":"CQ009","rendering_profile":"CORPORATE_STANDARD","locale":"de-DE","language_level":"STANDARD","text":"Was ist Ihnen an dieser Situation besonders wichtig?","rephrase_type":"CANONICAL","leadingness":0.2,"specificity":0.7,"intimacy_level":0.1,"spiritual_explicitness":0,"relational_warmth":0.5,"requires_opt_in":false,"status":"APPROVED","version":1},
    {"contract_version":"0.1","rendering_id":"CQ013:PRIVATE_STANDARD:v1","question_id":"CQ013","rendering_profile":"PRIVATE_STANDARD","locale":"de-DE","language_level":"STANDARD","text":"Welchen Satz sagst du dir selbst am häufigsten über diese Situation?","rephrase_type":"CANONICAL","leadingness":0.3,"specificity":0.8,"intimacy_level":0.35,"spiritual_explicitness":0,"relational_warmth":0.5,"requires_opt_in":false,"status":"APPROVED","version":1},
    {"contract_version":"0.1","rendering_id":"CQ013:CORPORATE_STANDARD:v1","question_id":"CQ013","rendering_profile":"CORPORATE_STANDARD","locale":"de-DE","language_level":"STANDARD","text":"Welcher Satz taucht in Ihrer Beschreibung dieser Situation besonders häufig auf?","rephrase_type":"CANONICAL","leadingness":0.25,"specificity":0.8,"intimacy_level":0.2,"spiritual_explicitness":0,"relational_warmth":0.5,"requires_opt_in":false,"status":"APPROVED","version":1},
    {"contract_version":"0.1","rendering_id":"CQ021:PRIVATE_STANDARD:v1","question_id":"CQ021","rendering_profile":"PRIVATE_STANDARD","locale":"de-DE","language_level":"STANDARD","text":"Was meinst du genau, wenn du dieses Wort verwendest?","rephrase_type":"CANONICAL","leadingness":0.15,"specificity":0.9,"intimacy_level":0.1,"spiritual_explicitness":0,"relational_warmth":0.5,"requires_opt_in":false,"status":"APPROVED","version":1},
    {"contract_version":"0.1","rendering_id":"CQ021:CORPORATE_STANDARD:v1","question_id":"CQ021","rendering_profile":"CORPORATE_STANDARD","locale":"de-DE","language_level":"STANDARD","text":"Was meinen Sie genau, wenn Sie dieses Wort verwenden?","rephrase_type":"CANONICAL","leadingness":0.15,"specificity":0.9,"intimacy_level":0.05,"spiritual_explicitness":0,"relational_warmth":0.5,"requires_opt_in":false,"status":"APPROVED","version":1},